{
  "$schema": "https://json-schema.org/draft/2020-12/schema",
  "$id": "urn:libredi:schema:job-envelope:1",
  "title": "Job envelope",
  "description": "Common shape of every message sent through the PostgreSQL job queue (pgmq). The payload is described by the schema of its job type. Raw EDI bytes never travel in the queue: the payload holds an archive reference (claim check).",
  "type": "object",
  "required": ["schemaVersion", "type", "messageId", "environment", "enqueuedAt", "payload"],
  "properties": {
    "schemaVersion": {
      "description": "Version of this envelope. Readers ignore unknown properties within a version.",
      "const": 1
    },
    "type": {
      "description": "Job type, lower case, dot separated: domain then action.",
      "type": "string",
      "pattern": "^[a-z][a-z0-9-]*(\\.[a-z][a-z0-9-]*)+$",
      "examples": ["message.parse"]
    },
    "messageId": {
      "description": "The Libredi message this job works on.",
      "type": "string",
      "format": "uuid"
    },
    "correlationId": {
      "description": "Groups the jobs of one flow run, for tracing.",
      "type": "string",
      "format": "uuid"
    },
    "environment": {
      "description": "Test and production never share a queue message.",
      "enum": ["test", "production"]
    },
    "enqueuedAt": {
      "type": "string",
      "format": "date-time"
    },
    "payload": {
      "description": "Job-specific data, validated against the schema of the job type.",
      "type": "object"
    }
  }
}
