{
  "schemaVersion": 1,
  "type": "message.parse",
  "messageId": "0b0a5f5e-5d0c-4f43-9d52-4a3f0d9d7a11",
  "correlationId": "7c1d3a52-93f6-4a7b-8d19-2f6a1b0c5e34",
  "environment": "test",
  "enqueuedAt": "2026-01-15T09:30:00Z",
  "payload": {
    "archiveSha256": "0000000000000000000000000000000000000000000000000000000000000000"
  }
}
